{
  "claim_boundary": "Accepted claims may enrich only their declared dataset or channel-group scope. They do not create subject- or trial-specific observations, prove electrode-to-single-muscle identity, replace absent static calibration measurements, or establish physiological comparability.",
  "claims": [
    {
      "claim_id": "study31-article-emg-rate",
      "evidence_sha256": "4f9ad072d36540b76d18342a6fb2f7c238e5e3dc0e00cf385f9292c1a0740f20",
      "extraction_method": "frozen-regex:capture",
      "extraction_status": "extracted",
      "locator": "Instrumentation & data collection",
      "machine_action": "enrich",
      "match_count": 1,
      "match_spans": [
        [
          411,
          431
        ]
      ],
      "message": null,
      "propagation": "all-descendants",
      "property_path": "recording.emg.sampling_rate_hz",
      "requires_human_review": false,
      "schema_version": "1.0.0",
      "scope_level": "channel-group",
      "scope_selector": {
        "sensor_type": "surface-emg"
      },
      "source_id": "study31-article-jats",
      "source_role": "authority",
      "source_sha256": "6a413fbd865d4b88d44750a19a04fe1a4bd52004f2b4da315b5ae12d8fff110b",
      "source_type": "peer-reviewed-article",
      "study_id": "study31",
      "value": 2000
    },
    {
      "claim_id": "study31-article-emg-channel-count",
      "evidence_sha256": "19880ac2eccf1769b8c938c1a50ff2795a494da452d917567f1bca72780021fe",
      "extraction_method": "frozen-regex:capture",
      "extraction_status": "extracted",
      "locator": "Instrumentation & data collection",
      "machine_action": "enrich",
      "match_count": 1,
      "match_spans": [
        [
          313,
          350
        ]
      ],
      "message": null,
      "propagation": "none",
      "property_path": "recording.emg.channel_count",
      "requires_human_review": false,
      "schema_version": "1.0.0",
      "scope_level": "dataset",
      "scope_selector": {
        "sensor_type": "surface-emg"
      },
      "source_id": "study31-article-jats",
      "source_role": "authority",
      "source_sha256": "6a413fbd865d4b88d44750a19a04fe1a4bd52004f2b4da315b5ae12d8fff110b",
      "source_type": "peer-reviewed-article",
      "study_id": "study31",
      "value": 8
    },
    {
      "claim_id": "study31-article-emg-muscles",
      "evidence_sha256": "1887adfb18980329247d74b03a90a27227e6e561b50ee8cd00e030d0de0df36c",
      "extraction_method": "frozen-regex:presence",
      "extraction_status": "extracted",
      "locator": "Instrumentation & data collection",
      "machine_action": "enrich",
      "match_count": 1,
      "match_spans": [
        [
          446,
          535
        ]
      ],
      "message": null,
      "propagation": "all-descendants",
      "property_path": "recording.emg.covered_muscles",
      "requires_human_review": false,
      "schema_version": "1.0.0",
      "scope_level": "channel-group",
      "scope_selector": {
        "sensor_type": "surface-emg"
      },
      "source_id": "study31-article-jats",
      "source_role": "authority",
      "source_sha256": "6a413fbd865d4b88d44750a19a04fe1a4bd52004f2b4da315b5ae12d8fff110b",
      "source_type": "peer-reviewed-article",
      "study_id": "study31",
      "value": [
        "biceps_femoris",
        "gastrocnemius_lateralis",
        "tibialis_anterior",
        "vastus_lateralis"
      ]
    },
    {
      "claim_id": "study31-article-emg-sides",
      "evidence_sha256": "050a121a1127b4a4e3895a6e65646989e8b759ea57aad1a9df728df8c2aadcfe",
      "extraction_method": "frozen-regex:presence",
      "extraction_status": "extracted",
      "locator": "Instrumentation & data collection",
      "machine_action": "enrich",
      "match_count": 1,
      "match_spans": [
        [
          496,
          535
        ]
      ],
      "message": null,
      "propagation": "all-descendants",
      "property_path": "recording.emg.laterality_set",
      "requires_human_review": false,
      "schema_version": "1.0.0",
      "scope_level": "channel-group",
      "scope_selector": {
        "sensor_type": "surface-emg"
      },
      "source_id": "study31-article-jats",
      "source_role": "authority",
      "source_sha256": "6a413fbd865d4b88d44750a19a04fe1a4bd52004f2b4da315b5ae12d8fff110b",
      "source_type": "peer-reviewed-article",
      "study_id": "study31",
      "value": [
        "left",
        "right"
      ]
    },
    {
      "claim_id": "study31-article-emg-unit",
      "evidence_sha256": "d0e01a56223c3735d8256a408e9f7ff94c169823839f85ab7a4ecd76c2995713",
      "extraction_method": "frozen-regex:presence",
      "extraction_status": "extracted",
      "locator": "Raw data",
      "machine_action": "enrich",
      "match_count": 1,
      "match_spans": [
        [
          614,
          653
        ]
      ],
      "message": null,
      "propagation": "all-descendants",
      "property_path": "recording.emg.raw_unit",
      "requires_human_review": false,
      "schema_version": "1.0.0",
      "scope_level": "channel-group",
      "scope_selector": {
        "representation": "raw",
        "sensor_type": "surface-emg"
      },
      "source_id": "study31-article-jats",
      "source_role": "authority",
      "source_sha256": "6a413fbd865d4b88d44750a19a04fe1a4bd52004f2b4da315b5ae12d8fff110b",
      "source_type": "peer-reviewed-article",
      "study_id": "study31",
      "value": "V"
    },
    {
      "claim_id": "study31-article-emg-bandpass",
      "evidence_sha256": "0cc461ecd40ce37922f52cbf38b523cf8378e1bd914840f0a7f0617f0054760c",
      "extraction_method": "frozen-regex:presence",
      "extraction_status": "extracted",
      "locator": "Dataset elaboration",
      "machine_action": "enrich",
      "match_count": 1,
      "match_spans": [
        [
          1935,
          2056
        ]
      ],
      "message": null,
      "propagation": "none",
      "property_path": "processing.emg.bandpass_hz",
      "requires_human_review": false,
      "schema_version": "1.0.0",
      "scope_level": "dataset",
      "scope_selector": {
        "representation": "processed-emg"
      },
      "source_id": "study31-article-jats",
      "source_role": "authority",
      "source_sha256": "6a413fbd865d4b88d44750a19a04fe1a4bd52004f2b4da315b5ae12d8fff110b",
      "source_type": "peer-reviewed-article",
      "study_id": "study31",
      "value": [
        20,
        450
      ]
    },
    {
      "claim_id": "study31-article-emg-rms-window",
      "evidence_sha256": "0d1d25e59dcdcde5decfb8182e0b77d02b379aaa9be2b18e25a2b87c06c8cf48",
      "extraction_method": "frozen-regex:capture",
      "extraction_status": "extracted",
      "locator": "Dataset elaboration",
      "machine_action": "enrich",
      "match_count": 1,
      "match_spans": [
        [
          2143,
          2196
        ]
      ],
      "message": null,
      "propagation": "none",
      "property_path": "processing.emg.rms_window_ms",
      "requires_human_review": false,
      "schema_version": "1.0.0",
      "scope_level": "dataset",
      "scope_selector": {
        "representation": "processed-emg-envelope"
      },
      "source_id": "study31-article-jats",
      "source_role": "authority",
      "source_sha256": "6a413fbd865d4b88d44750a19a04fe1a4bd52004f2b4da315b5ae12d8fff110b",
      "source_type": "peer-reviewed-article",
      "study_id": "study31",
      "value": 300
    },
    {
      "claim_id": "study31-article-static-performed",
      "evidence_sha256": "db58cf31440bad571c83fa41c9d6f6914eab357da1418f169db4bef248983cdd",
      "extraction_method": "frozen-regex:presence",
      "extraction_status": "extracted",
      "locator": "Experimental protocol",
      "machine_action": "boundary-only",
      "match_count": 1,
      "match_spans": [
        [
          1903,
          1950
        ]
      ],
      "message": null,
      "propagation": "none",
      "property_path": "acquisition.motion_capture.static_trial_performed",
      "requires_human_review": false,
      "schema_version": "1.0.0",
      "scope_level": "cohort",
      "scope_selector": {
        "modality": "motion-capture"
      },
      "source_id": "study31-article-jats",
      "source_role": "authority",
      "source_sha256": "6a413fbd865d4b88d44750a19a04fe1a4bd52004f2b4da315b5ae12d8fff110b",
      "source_type": "peer-reviewed-article",
      "study_id": "study31",
      "value": true
    },
    {
      "claim_id": "study31-config-emg-rate",
      "evidence_sha256": "91c0326d8e7d5fbff1ba19c358e1da799e0b39397bea27684335dc70b21d7c71",
      "extraction_method": "frozen-regex:capture",
      "extraction_status": "extracted",
      "locator": "document",
      "machine_action": "enrich",
      "match_count": 1,
      "match_spans": [
        [
          301,
          427
        ]
      ],
      "message": null,
      "propagation": "none",
      "property_path": "recording.emg.sampling_rate_hz",
      "requires_human_review": false,
      "schema_version": "1.0.0",
      "scope_level": "channel-group",
      "scope_selector": {
        "sensor_type": "surface-emg"
      },
      "source_id": "study31-device-config",
      "source_role": "observation",
      "source_sha256": "263d7e27a5a90f9aad3ae3519d377b3d25ce79ffc80c5d63eb8e59dd737e48f7",
      "source_type": "repository-config",
      "study_id": "study31",
      "value": 2000
    },
    {
      "claim_id": "study31-config-emg-channel-count",
      "evidence_sha256": "9d7b07e660aa2cb2025cf938dc131950dcd1135738a3bbd0f20c9384e27e4c08",
      "extraction_method": "frozen-regex:count",
      "extraction_status": "extracted",
      "locator": "document",
      "machine_action": "enrich",
      "match_count": 8,
      "match_spans": [
        [
          2603,
          2620
        ],
        [
          2670,
          2688
        ],
        [
          2747,
          2764
        ],
        [
          2817,
          2834
        ],
        [